{
  "version": "1.0",
  "brief": {
    "genre": "jungle breakbeat",
    "bpm": 170,
    "meter": "4/4",
    "key": "D",
    "mode": "minor",
    "length_bars": 8,
    "creative_constraint": "foreground rhythm comes from one user-provided Amen-style break sample"
  },
  "sample_assets": [
    {
      "id": "amen_break",
      "source": "user_sample_library",
      "path_ref": "AMEN_BREAK_WAV",
      "original_bpm": 136,
      "bars": 4,
      "trim": "downbeat_aligned",
      "rights_status": "user_provided"
    }
  ],
  "tracks": [
    {
      "name": "Amen Loop",
      "role": "foreground rhythm",
      "source_type": "audio_loop",
      "sample_ref": "amen_break",
      "clip_length_bars": 4,
      "browser_query": "No browser search: user-provided audio sample",
      "notes": [],
      "audio_clip": {
        "warp": true,
        "warp_mode": "beats",
        "loop": true,
        "gain_db": -6.0,
        "transpose_semitones": 0
      }
    }
  ],
  "sections": [
    {
      "name": "Intro",
      "start_bar": 1,
      "length_bars": 4,
      "density": 2,
      "active_tracks": ["Amen Loop"],
      "foreground": ["Amen Loop"],
      "midground": [],
      "background": [],
      "identity_carrier": "Amen Loop",
      "move": "filtered loop with gain held back",
      "transition_event": "half-bar filter open into Drop"
    },
    {
      "name": "Drop",
      "start_bar": 5,
      "length_bars": 4,
      "density": 5,
      "active_tracks": ["Amen Loop"],
      "foreground": ["Amen Loop"],
      "midground": [],
      "background": [],
      "identity_carrier": "Amen Loop",
      "move": "full warped loop",
      "transition_event": "mute final sixteenth for loop return"
    }
  ],
  "handoff": {
    "requires_browser_search": false,
    "browser_queries": ["No browser search"],
    "sample_asset_refs": ["amen_break"],
    "export_target": "8-bar jungle Amen audio-loop rough loop"
  },
  "finish_criteria": [
    "8-bar breakbeat sketch exists",
    "Amen source is referenced through sample_assets, not browser_query",
    "audio clip warp, loop, and gain intent are present",
    "Ableton handoff can be dry-run before modifying Live"
  ]
}
